categories,productos,coto_id,name,price,unit_price
Alimentos Secos,Alimento Bebe,256573,Cereal Infantil Arroz C/Hierro NESTUM Cja 200 Grm,42.99,Precio por 1 Kilo : $214.95
Alimentos Secos,Alimento Bebe,256569,Cereal Infantil Bebible Trigo NESTUM Bsa 400 Grm,59.99,Precio por 1 Kilo : $149.97
Alimentos Secos,Alimento Bebe,267194,Cereal Infantil Espinaca Vegetales NESTUM 200 Grm,42.99,Precio por 1 Kilo : $214.95
Alimentos Secos,Alimento Bebe,262154,Cereal Infantil NESTUM Multicereal C/Hierro Bsa 500 G,66.99,Precio por 1 Kilo : $133.98
Alimentos Secos,Sabores Del Mundo,228929,Chucrut ALCARAZ Fra 310 Grm,77.15,Precio por 1 Kilo escurrido: $275.53
"Alimentos Secos,Sabores Del Mundo,258621,Condimento Ahumado SAN GIORGIO Fra 75 Grm,75.99,""Precio por 1 Kilo : $1,013.20"""
Alimentos Secos,Sabores Del Mundo,204747,Confitura Patagonia Berries Light Frut. Bosque Fra 260 Grm,80.25,Precio por 1 Kilo : $308.65
Alimentos Secos,Sabores Del Mundo,204749,Confitura Patagonia Berries Light Frutilla Fra 260 Grm,81.35,Precio por 1 Kilo : $312.88
Alimentos Secos,Sabores Del Mundo,204748,Confitura Patagonia Berries Light Zarzamora Fra 260 Grm,74.89,Precio por 1 Kilo : $288.03
Alimentos Secos,Sabores Del Mundo,255980,Crema Avellana NUTELLA Pot 350 Grm,100.89,Precio por 1 Kilo : $288.25
Alimentos Secos,Sabores Del Mundo,172569,Crema De Avellana NUTELLA Pot 140 Grm,52.95,Precio por 1 Kilo : $378.21
Alimentos Secos,Sabores Del Mundo,230665,Dulce De Cerezas Negras MASSEUBE Fra 450 Grm,101.65,Precio por 1 Kilo : $225.88
Alimentos Secos,Sabores Del Mundo,230664,Dulce De Frambuesa MASSEUBE Fra 450 Grm,123.05,Precio por 1 Kilo : $273.44
Alimentos Secos,Sabores Del Mundo,33671,Dulce De Frutilla CABAÑA MICO Fra 454 Grm,85.59,Precio por 1 Kilo : $188.52
Alimentos Secos,Sabores Del Mundo,230660,Dulce De Frutillas MASSEUBE Fra 450 Grm,100.59,Precio por 1 Kilo : $223.53
Alimentos Secos,Sabores Del Mundo,230668,Dulce De Frutos Del Bosque MASSEUBE Fra 450 Grm,123.05,Precio por 1 Kilo : $273.44
Alimentos Secos,Leches En Polvo,257385,Leche En Polvo Entera Con Vit SANCOR Cja 800 Grm,128.39,Precio por 1 Kilo : $160.48
Alimentos Secos,Leches En Polvo,128296,Leche En Polvo Entera COTO Est 800 Grm,86.69,Precio por 1 Kilo : $108.36
Alimentos Secos,Leches En Polvo,198744,Leche En Polvo Entera FORMIDABLE Pou 800 Grm,81.35,Precio por 1 Kilo : $101.68
Alimentos Secos,Leches En Polvo,263028,Leche En Polvo Entera LA LECHERA Con Zinc Pou 800 Grm,89.89,Precio por 1 Kilo : $112.36
Alimentos Secos,Leches En Polvo,289061,Leche En Polvo Entera LA SERENISIMA Baby 1 Lat 750 Grm,200.79,Precio por 1 Kilo : $267.72
Alimentos Secos,Leches En Polvo,289062,Leche En Polvo Entera LA SERENISIMA Baby 3 Lat 750 Grm,156.25,Precio por 1 Kilo : $208.33
Alimentos Secos,Leches En Polvo,3120,Leche En Polvo Entera LA SERENISIMA Deslac. Est 500 Grm,113.45,Precio por 1 Kilo : $226.90
Alimentos Secos,Leches En Polvo,289060,Leche En Polvo Entera La Serenísima Baby 2 Lat 750 Grm,192.59,Precio por 1 Kilo : $256.78
Alimentos Secos,Leches En Polvo,284966,Leche En Polvo Entera NIDO Con Chocolate Pou 360 Grm,49.23,Precio por 1 Kilo : $136.75
Alimentos Secos,Leches En Polvo,284967,Leche En Polvo Entera NIDO Con Chocolate Pou 720 Grm,105.95,Precio por 1 Kilo : $147.15
Alimentos Secos,Leches En Polvo,114609,Leche En Polvo Entera PURISIMA Est 800 Grm,92.05,Precio por 1 Kilo : $115.06
Alimentos Secos,Leches En Polvo,256089,Leche En Polvo Entera SANCOR Vitamina Ayb Cja 400 Grm,70.65,Precio por 1 Kilo : $176.62
Alimentos Secos,Legumbres,69719,Garbanzos Sec.Remo LA BANDA Lat 350 Grm,21.39,Precio por 1 Kilogramo escurrido: $106.95
Alimentos Secos,Legumbres,262113,Jardinera EGRAN Legumbres Y Cereales Bsa 500 Grm,24.6,Precio por 1 Kilo escurrido: $49.20
Alimentos Secos,Legumbres,15474,Lentejas ADENOMAR Bol 400 Grm,16.05,Precio por 1 Kilo : $40.12
Alimentos Secos,Legumbres,171604,Lentejas CIUDAD DEL LAGO Bol 500 Grm,29.95,Precio por 1 Kilo : $59.90
Alimentos Secos,Legumbres,171605,Lentejas COTO Bol 500 Grm,31.05,Precio por 1 Kilo : $62.10
Alimentos Secos,Legumbres,227582,Lentejas Don ELIO Rojas Peladas Bsa 400 Grm,49.25,Precio por 1 Kilo escurrido: $123.12
Alimentos Secos,Legumbres,262106,Lentejas EGRAN Super Rapidas Paq 400 Grm,29.99,Precio por 1 Kilo escurrido: $59.98
Alimentos Secos,Legumbres,27685,Lentejas ELIO Bol 400 Grm,22.49,Precio por 1 Kilo : $56.22
Alimentos Secos,Legumbres,204315,Lentejas INCA Secas Remojadas Lat 350 Grm,18.19,Precio por 1 Kilo escurrido: $90.05
Alimentos Secos,Legumbres,78645,Lentejas LA EGIPCIANA Bol 400 Grm,28.89,Precio por 1 Kilo : $72.22
Alimentos Secos,Legumbres,287155,Lentejas LA EGIPCIANA Secas Remojadas Lat 350 Grm,17.15,Precio por 1 Kilogramo escurrido: $85.75
Alimentos Secos,Legumbres,170564,Lentejas LONQUIMAY Bol 400 Grm,22.49,Precio por 1 Kilo : $56.22
Alimentos Secos,Encurtidos,101922,Aceitunas Negras NUCETE Fra 330 Grm,56.7,Precio por 1 Kilo escurrido: $283.50
Alimentos Secos,Encurtidos,263031,Aceitunas Negras VANOLI Pou 150 Grm,21.39,Precio por 1 Kilo escurrido: $267.37
Alimentos Secos,Encurtidos,7109,Aceitunas Negras Yovinesa  Doy 250 Grm,22.49,Precio por 1 Kilogramo escurrido: $124.95
Alimentos Secos,Encurtidos,247698,Aceitunas Negras YOVINESSA En Salmuera Sch 100 Grm,20.35,Precio por 1 Kilo escurrido: $156.53
Alimentos Secos,Encurtidos,234350,Aceitunas Negras YOVINESSA Premium Fra 330 Grm,56.7,Precio por 1 Kilo escurrido: $283.50
Alimentos Secos,Encurtidos,248143,Aceitunas Prem. Aceitunas Rell BULERIAS Lat 200 Grm,53.49,Precio por 1 Kilo escurrido: $267.45
Alimentos Secos,Encurtidos,248141,Aceitunas Prem. Aceitunas Rell BULERIAS Lat 200 Grm,53.49,Precio por 1 Kilo escurrido: $267.45
Alimentos Secos,Encurtidos,248144,Aceitunas Prem. Aceitunas Rell BULERIAS Lat 200 Grm,53.49,Precio por 1 Kilo escurrido: $629.29
Alimentos Secos,Encurtidos,248142,Aceitunas Prem. Aceitunas Rell BULERIAS Lat 200 Grm,53.49,Precio por 1 Kilo escurrido: $629.29
Alimentos Secos,Encurtidos,269677,Aceitunas Verdes ATILIO AVENA En Salm Arauco Premium Fra 500,87.19,Precio por 1 Kilo escurrido: $174.38
Alimentos Secos,Encurtidos,286193,Aceitunas Verdes ATILIO AVENA Premiun En Pasta Fra 170 Grm,53.7,Precio por 1 Kilo : $315.88
Alimentos Secos,Encurtidos,221912,Aceitunas Verdes Castel Premium Rellenas Fra 360 Grm,64.19,Precio por 1 Kilo escurrido: $291.77
Alimentos Secos,Panadería - Elaboración Propia,47502,Bollitos Jamon COTO X Kg,53.89,Precio por 1 Kilogramo : $53.89
Alimentos Secos,Panadería - Elaboración Propia,47504,Bollitos Multicereal COTO X Kg,53.89,Precio por 1 Kilogramo : $53.89
Alimentos Secos,Panadería - Elaboración Propia,44058,Bollitos Oregano COTO X Kg,53.89,
Alimentos Secos,Panadería - Elaboración Propia,204043,Brownie Con Nuez LA TORTERIA Bli 1 Uni,39,Precio por 1 Unidad : $39.00
Alimentos Secos,Panadería - Elaboración Propia,44615,Budin Crujiente De Chocolate LA TORTERIA X Uni,39,Precio por 1 Unidad : $39.00
Alimentos Secos,Panadería - Elaboración Propia,44618,Budin De Dulce De Leche LA TORTERIA X Uni,39,Precio por 1 Unidad : $39.00
Alimentos Secos,Panadería - Elaboración Propia,44609,Budin De Frutiila LA TORTERIA X Uni,39,Precio por 1 Unidad : $39.00
Alimentos Secos,Panadería - Elaboración Propia,44614,Budin De Frutos Secos LA TORTERIA X Uni,39,Precio por 1 Unidad : $39.00
Alimentos Secos,Panadería - Elaboración Propia,44590,Budin De Limon X Uni,26.5,Precio por 1 Unidad : $26.50
Alimentos Secos,Panadería - Elaboración Propia,44610,Budin De Manzana LA TORTERIA X Uni,39,Precio por 1 Unidad : $39.00
Alimentos Secos,Panadería - Elaboración Propia,44611,Budin De Peras Al Natural LA TORTERIA X Uni,39,Precio por 1 Unidad : $39.00
Alimentos Secos,Panadería - Elaboración Propia,44601,Budin De Vainilla X Uni,26.5,Precio por 1 Unidad : $26.50
Alimentos Secos,Tostadas,55584,Tostadas BREVISS Sin Sal Bol 140 Grm,31.95,Precio por 1 Kilo : $228.21
Alimentos Secos,Tostadas,181856,Tostadas BREVISS Sin Sal Paq 200 Grm,29.95,Precio por 1 Kilo : $149.75
Alimentos Secos,Tostadas,294573,Tostadas Castañas Y Gra BAUDUCCO Paq 160 Grm,36.39,Precio por 1 Kilo : $227.43
Alimentos Secos,Tostadas,188338,Tostadas CEREALITAS De Arroz Paq 160 Grm,48.95,Precio por 1 Kilo : $305.93
Alimentos Secos,Tostadas,294525,Tostadas Con Avena BAUDUCCO Paq 160 Grm,36.39,Precio por 1 Kilo : $227.43
Alimentos Secos,Tostadas,213356,Tostadas CRIOLLITAS Clasicas Paq 200 Grm,27.35,Precio por 1 Kilo : $136.75
Alimentos Secos,Tostadas,255981,Tostadas CRIOLLITAS Dulces Paq 200 Grm,27.95,Precio por 1 Kilo : $139.75
Alimentos Secos,Tostadas,213357,Tostadas CRIOLLITAS Salvado Paq 200 Grm,27.35,Precio por 1 Kilo : $136.75
Alimentos Secos,Tostadas,244835,Tostadas FITZ ROY Dietetica Multicereal Bsa 200 Grm,39.59,Precio por 1 Kilo : $197.95
Alimentos Secos,Tostadas,123074,Tostadas Integrales BAUDUCCO Paq 160 Grm,36.39,Precio por 1 Kilo : $227.43
Alimentos Secos,Tostadas,240008,Tostadas Light FITZ ROY Paq 225 Grm,31.4,Precio por 1 Kilo : $139.55
Alimentos Secos,Tostadas,272015,Tostadas SER Horneadas Paq 200 Grm,32.45,Precio por 1 Kilo escurrido: $162.25
Alimentos Secos,Rebozador Y Pan Rallado,263039,Rebozador P/Horno PREFERIDO Paq 1 Kgm,55.2,Precio por 1 Kilogramo : $55.20
Alimentos Secos,Rebozador Y Pan Rallado,263037,Rebozador P/Horno PREFERIDO Paq 500 Grm,28.59,Precio por 1 Kilo : $57.18
Alimentos Secos,Rebozador Y Pan Rallado,257846,Rebozador PREFERIDO Bsa 1 Kgm,40.15,Precio por 1 Kilogramo : $40.15
Alimentos Secos,Rebozador Y Pan Rallado,257845,Rebozador PREFERIDO Paq 500 Grm,19.59,Precio por 1 Kilo : $39.18
Alimentos Secos,Polvo Para Postres,263072,Leche Condensada NESTLE Descremada Lat 395 Grm,51.35,Precio por 1 Kilo : $130.00
Alimentos Secos,Polvo Para Postres,262892,Leche Condensada NESTLE Entera Lat 397 Grm,52.45,Precio por 1 Kilo : $132.11
Alimentos Secos,Polvo Para Postres,248489,Mousse Dulce De Leche ROYAL Sob 30 Grm,10.4,Precio por 100 Gramos : $34.67
Alimentos Secos,Polvo Para Postres,210330,Mousse Light Chocolate Espe ROYAL Est 40 Grm,10.4,Precio por 100 Gramos : $26.00
Alimentos Secos,Polvo Para Postres,269830,Polvo P/Bizcochuelo ARTESANA Chocolate Bsa 480 Grm,18.75,Precio por 1 Kilogramo : $39.07
Alimentos Secos,Polvo Para Postres,269828,Polvo P/Bizcochuelo ARTESANA Vainilla Bsa 480 Grm,14.99,Precio por 1 Kilogramo : $31.23
Alimentos Secos,Polvo Para Postres,263447,Polvo P/Bizcochuelo BARBARA Chocolate Pou 450 Grm,18.09,Precio por 1 Kilogramo : $40.20
Alimentos Secos,Polvo Para Postres,263448,Polvo P/Bizcochuelo BARBARA Limon Pou 450 Grm,13.9,Precio por 1 Kilogramo : $30.89
Alimentos Secos,Polvo Para Postres,263449,Polvo P/Bizcochuelo BARBARA Naranja Pou 450 Grm,13.9,Precio por 1 Kilogramo : $30.89
Alimentos Secos,Polvo Para Postres,263450,Polvo P/Bizcochuelo BARBARA Vainilla Pou 450 Grm,13.9,Precio por 1 Kilogramo : $30.89
Alimentos Secos,Polvo Para Postres,8221,Polvo P/Bizcochuelo CASERITA Naranja Cja 540 Grm,23.55,Precio por 1 Kilo : $43.61
Alimentos Secos,Polvo Para Postres,8222,Polvo P/Bizcochuelo CASERITA Vainilla Cja 540 Grm,23.55,Precio por 1 Kilo : $43.61
Alimentos Secos,Bizcochuelos - Budines - Especialidades,109386,Bizcochos Agridulce DON SATUR Bol 200 Grm,11.79,Precio por 1 Kilo : $58.95
Alimentos Secos,Bizcochuelos - Budines - Especialidades,263240,Bizcochos Agridulce DULCYPAS Paq 200 Grm,10.69,Precio por 1 Kilo : $53.45
Alimentos Secos,Bizcochuelos - Budines - Especialidades,109385,Bizcochos Azucar Negra DON SATUR Bol 200 Grm,11.79,Precio por 1 Kilo : $58.95
Alimentos Secos,Bizcochuelos - Budines - Especialidades,174819,Bizcochos Azucarad Tia Maruca Bsa 250 Grm,16.39,Precio por 1 Kilo : $65.56
Alimentos Secos,Bizcochuelos - Budines - Especialidades,7056,Bizcochos Azucarados 9 DE ORO Bol 210 Grm,12.29,Precio por 1 Kilo : $58.52
Alimentos Secos,Bizcochuelos - Budines - Especialidades,30039,Bizcochos Azucarados ARCOR Bol 225 Grm,11.45,Precio por 1 Kilo : $57.25
Alimentos Secos,Bizcochuelos - Budines - Especialidades,71020,Bizcochos Azucarados GOLD MUNDO Bol 200 Grm,15.15,Precio por 1 Kilo : $75.75
Alimentos Secos,Bizcochuelos - Budines - Especialidades,257642,Bizcochos De Arroz Gallo Dulce Bsa 100 Grm,24.99,Precio por 1 Kilo : $249.90
Alimentos Secos,Bizcochuelos - Budines - Especialidades,257641,Bizcochos De Arroz Gallo Salados Bsa 100 Grm,24.99,Precio por 1 Kilo : $249.90
Alimentos Secos,Bizcochuelos - Budines - Especialidades,4606,Bizcochos De Grasa 9 DE ORO Bol 200 Grm,12.29,Precio por 1 Kilo : $61.45
Alimentos Secos,Bizcochuelos - Budines - Especialidades,30016,Bizcochos De Grasa ARCOR Bol 200 Grm,11.45,Precio por 1 Kilo : $57.25
Alimentos Secos,Bizcochuelos - Budines - Especialidades,72310,Bizcochos De Grasa GOLD MUNDO Bol 200 Grm,14.45,Precio por 1 Kilo : $72.25
Alimentos Secos,Arroz,264990,Arroz GALLO Integral Est 1 Kgm,38.55,Precio por 1 Kilogramo escurrido: $38.55
Alimentos Secos,Arroz,264987,Arroz GALLO Integral Paq 500 Grm,20.35,Precio por 1 Kilogramo : $40.70
Alimentos Secos,Arroz,264989,Arroz GALLO Largo Fino Est 1 Kgm,25.65,Precio por 1 Kilogramo escurrido: $25.65
Alimentos Secos,Arroz,264657,Arroz GALLO Largo Fino Paq 1 Kgm,25.69,Precio por 1 Kilogramo escurrido: $25.69
Alimentos Secos,Arroz,264986,Arroz GALLO Largo Fino Paq 500 Grm,13.9,Precio por 1 Kilogramo : $27.80
Alimentos Secos,Arroz,264557,Arroz GALLO Oro Est 1 Kgm,32.99,Precio por 1 Kilogramo escurrido: $32.99
Alimentos Secos,Arroz,254801,Arroz KNORR Listo 4 Quesos Sob 185 Grm,41.79,Precio por 1 Kilogramo : $225.90
Alimentos Secos,Arroz,255698,Arroz KNORR Listo Primavera Sob 197 Grm,40.69,Precio por 1 Kilo : $206.54
Alimentos Secos,Arroz,254800,Arroz KNORR Listo Tipo Paella Sob 185 Grm,39.75,Precio por 1 Kilogramo : $217.22
Alimentos Secos,Arroz,263230,Arroz KNORR Listo Vegetales Y Pollo Sob 191 Grm,41.75,Precio por 1 Kilogramo : $218.59
Alimentos Secos,Arroz,288062,Arroz Koshihikari DOS HERMANOS Cja 500 Grm,25.45,Precio por 1 Kilo : $50.90
Alimentos Secos,Arroz,251434,Arroz Largo Fino LUCCHETTI  00000 Paq 500 Grm,8.99,Precio por 1 Kilo : $17.98
Alimentos Secos,Mermeladas Y Dulces,242494,Dulce Frutos Del Bosque CABAÑA MICO Fra 454 Grm,97.39,Precio por 1 Kilo : $214.51
Alimentos Secos,Mermeladas Y Dulces,3236,Jalea De Membrillo LA CAMPAGNOLA Fra 454 Grm,49.25,Precio por 1 Kilo : $108.48
Alimentos Secos,Mermeladas Y Dulces,271792,Jalea De Membrillo Light CORMILLOT Fra 390 Grm,39.59,Precio por 1 Kilo : $101.51
Alimentos Secos,Mermeladas Y Dulces,10494,Mermelada ARCOR Ciruela Fra 454 Grm,19.85,Precio por 1 Kilo : $43.72
Alimentos Secos,Mermeladas Y Dulces,10495,Mermelada ARCOR Damasco Fra 454 Grm,33.69,Precio por 1 Kilo : $74.20
Alimentos Secos,Mermeladas Y Dulces,10496,Mermelada ARCOR Durazno Fra 454 Grm,33.69,Precio por 1 Kilo : $74.20
Alimentos Secos,Mermeladas Y Dulces,2330,Mermelada ARCOR Frutilla Fra 454 Grm,42.79,Precio por 1 Kilo : $94.25
Alimentos Secos,Mermeladas Y Dulces,10663,Mermelada ARCOR Naranja Fra 454 Grm,33.69,Precio por 1 Kilo : $74.20
Alimentos Secos,Mermeladas Y Dulces,70175,Mermelada Artesanal EL BOLSON Frambuesa Fra 454 Grm,88.8,Precio por 1 Kilo : $195.59
Alimentos Secos,Mermeladas Y Dulces,70174,Mermelada Artesanal EL BOLSON Frutilla Fra 454 Grm,85.59,Precio por 1 Kilo : $188.52
Alimentos Secos,Mermeladas Y Dulces,70171,Mermelada Artesanal EL BOLSON Manzana Fra 454 Grm,72.75,Precio por 1 Kilo : $160.24
Alimentos Secos,Mermeladas Y Dulces,70176,Mermelada Artesanal EL BOLSON Zarzamora Fra 454 Grm,100.59,Precio por 1 Kilo : $221.56
Alimentos Secos,Galletitas,238082,Galletas De Arroz GRANDIET Dulces Bsa 100 Grm,18.19,Precio por 1 Kilo : $181.90
Alimentos Secos,Galletitas,238081,Galletas De Arroz GRANDIET Integral Sin Sal Bsa 100 Grm,18.19,Precio por 1 Kilo : $181.90
Alimentos Secos,Galletitas,191069,Galletas De Arroz MACROBIOTICA Con Sal Paq 102 Grm,24.6,Precio por 1 Kilo : $241.17
Alimentos Secos,Galletitas,191070,Galletas De Arroz MACROBIOTICA Dulce Paq 102 Grm,24.6,Precio por 1 Kilo : $241.17
Alimentos Secos,Galletitas,181854,Galletas De Arroz MACROBIOTICA Integral Sin Sal Paq 102 Grm,24.6,Precio por 1 Kilo : $241.17
Alimentos Secos,Galletitas,264080,Galletas De Avena CACHAFAZ Almendra Y Mani Paq 225 Grm,32.09,Precio por 1 Kilo : $142.62
Alimentos Secos,Galletitas,264081,Galletas De Avena CACHAFAZ Chip De Chocolate Paq 225 Grm,32.09,Precio por 1 Kilo : $142.62
Alimentos Secos,Galletitas,284919,Galletas Dulces GRANDIET Chocolate Cja 150 Grm,64.19,Precio por 1 Kilo : $427.93
Alimentos Secos,Galletitas,284907,Galletas Dulces GRANDIET Coco Cja 150 Grm,64.19,Precio por 1 Kilo : $427.93
Alimentos Secos,Galletitas,284906,Galletas Dulces GRANDIET Limon Cja 150 Grm,64.19,Precio por 1 Kilo : $427.93
Alimentos Secos,Galletitas,284905,Galletas Dulces GRANDIET Miel Cja 150 Grm,64.19,Precio por 1 Kilo : $427.93
Alimentos Secos,Galletitas,261024,Galletas LA BIZANTINA Avena,25.95,Precio por 1 Kilo : $144.16
Alimentos Frescos,Lácteos,255684,Crema De Leche LA SERENISIMA F/ Vitaminas A/E Ctn 200 Cmq,21.89,Precio por 1 Litro : $109.45
Alimentos Frescos,Lácteos,281956,Crema De Leche LA SERENISIMA Light Pot 200 Cmq,22.65,Precio por 1 Litro : $113.25
Alimentos Frescos,Lácteos,258462,Crema De Leche LA SERENISIMA Vitamina A/E Ctn 500 Cc,55.49,Precio por 1 Litro : $110.98
Alimentos Frescos,Lácteos,89286,Crema De Leche MILKAUT Pot 360 Cc,38.55,Precio por 1 Litro : $107.08
Alimentos Frescos,Lácteos,251615,Crema De Leche SANCOR Light Pot 200 Cc,21.09,Precio por 1 Litro : $105.45
Alimentos Frescos,Lácteos,251611,Crema De Leche SANCOR Multivitaminas Pot 200 Cc,21.35,Precio por 1 Litro : $106.75
Alimentos Frescos,Lácteos,251616,Crema De Leche SANCOR Multivitaminas Pot 360 Cc,37.79,Precio por 1 Litro : $104.97
Alimentos Frescos,Lácteos,14553,Crema De Leche SANCOR Ttb 500 Cc,48.89,Precio por 1 Litro : $97.78
Alimentos Frescos,Lácteos,161832,Crema De Leche TREGAR Pot 200 Cc,16.39,Precio por 1 Litro : $81.95
Alimentos Frescos,Lácteos,161825,Crema De Leche TREGAR Pot 350 Cc,25.69,Precio por 1 Litro : $73.40
Alimentos Frescos,Lácteos,251610,Crema Leche Uat SANCOR Ttb 250 Cmq,17.09,Precio por 1 Litro : $68.36
Alimentos Frescos,Lácteos,224958,Dulce De Leche COTO Fra 450 Grm,38.55,Precio por 1 Kilo : $85.66
Otros,Deportes,216284,Aro Basket Comp C Volcada . . .,170.13,
Otros,Deportes,252167,Aro De Basket Nº7 . . . .,159.43,
Otros,Deportes,252166,Aro De Basket Nº7 Con Volcada . . .,191.53,
Otros,Deportes,218935,Banda Con Tobillera . . . .,266.5,
Otros,Deportes,218936,Banda En Forma De Ocho . . .,202.3,
Otros,Deportes,218937,Banda Larga Economica . . . .,277.2,
Otros,Deportes,219533,Banda Redonda . . . .,180.9,
Otros,Deportes,262818,Barra Con Topes Hueca . . . .,362.8,
Otros,Deportes,200896,Barral Para Ejercicios Top Fitness,399,
Otros,Deportes,223559,Bicicleta Fija De Ejercicio Manual 79x46x111 Cm.,399,
Otros,Deportes,182474,Bicicleta Playera Dama Rodado 26,749,
Otros,Deportes,209954,Bicicleta Plegable Mtdp-652-B-1 . . .,707,
Otros,Camping,270375,Alfombra Camping Con Licencia A . . .,405.6,
Otros,Camping,270376,Alfombra Camping Con Licencia B . . .,715.9,
Otros,Camping,245900,Almohada De Viaje Intex . . .,64.1,
Otros,Camping,245901,Almohada Inflable Niños Surtido . . .,58.8,
Otros,Camping,253336,Almohada Top Camping 27 X 36 Cm. . . .,96.2,
Otros,Camping,254522,Banqueta Alum. Camping Pleg. 40x35x42 Cm. . . .,213,
Otros,Camping,233630,Bolsa De Dormir Hello Kitty . . .,566.1,
Otros,Camping,270363,Bolsa De Dormir Minnie / Mickey . . .,566.1,
Otros,Camping,221717,Bolsa De Dormir Mummy 210 X 80 X 50 Cm,899,
Otros,Camping,129502,Bolsa De Dormir Top Camping 190 X 75 Cm,279,
Otros,Camping,129504,Bolsa De Dormir Top Camping Mummy 230 X 8 X 55 Cm,279,
Otros,Camping,221726,Bolso Termico P/ Camping 28 Lts . . .,416.3,
Alimentos Secos,Alimento Bebe,262155,Cereal Infantil NESTUM Multicereal C/Hierro Cja 200 G,42.99,Precio por 1 Kilo : $214.95
Alimentos Secos,Alimento Bebe,289055,Cereal Infantil NUTRILON 5 Cereales  Lat 200 Grm,66.05,Precio por 1 Kilo : $330.25
Alimentos Secos,Alimento Bebe,289059,Cereal Infantil NUTRILON Arroz Banana Y Manzana Lat 200 Grm,66.05,Precio por 1 Kilo : $330.25
Alimentos Secos,Alimento Bebe,289058,Cereal Infantil NUTRILON Arroz Lat 200 Grm,66.05,Precio por 1 Kilo : $330.25
Alimentos Secos,Alimento Bebe,289056,Cereal Infantil NUTRILON Maiz Lat 200 Grm,66.05,Precio por 1 Kilo : $330.25
Alimentos Secos,Alimento Bebe,256574,Cereal Infantil Trigo Y  Miel NESTUM Cja 200 Grm,42.99,Precio por 1 Kilo : $214.95
Alimentos Secos,Alimento Bebe,256571,Cereal Infantil Trigo Y Frutas NESTUM Cja 200 Grm,42.99,Precio por 1 Kilo : $214.95
Alimentos Secos,Alimento Bebe,267217,Cereal Infantil Zapallo Con Zanahoria Vegetales  NESTUM,42.99,Precio por 1 Kilo : $214.95
Alimentos Secos,Alimento Bebe,289057,Cereales Infantile Arroz Avena Ba NUTRILON Lat 200 Grm,66.05,Precio por 1 Kilo : $330.25
Alimentos Secos,Alimento Bebe,295394,Cereales Infantile Banana Nestum Paq .5 Kgm,96.29,Precio por 1 Kilogramo : $192.58
Alimentos Secos,Alimento Bebe,272650,Galletitas P/Bebe SMOOKIES Ciruela Y Banana Paq. 150 Grm,46.45,Precio por 1 Kilo : $309.66
Alimentos Secos,Alimento Bebe,272641,Galletitas P/Bebe SMOOKIES Ciruela Y Trigo Paq 150 Grm,46.45,Precio por 1 Kilo : $309.66
Alimentos Secos,Sabores Del Mundo,230663,Dulce De Guindas MASSEUBE Fra 450 Grm,106.99,Precio por 1 Kilo : $237.75
Alimentos Secos,Sabores Del Mundo,230661,Dulce De Mosquetas MASSEUBE Fra 450 Grm,100.05,Precio por 1 Kilo : $222.33
Alimentos Secos,Sabores Del Mundo,230662,Dulce De Sauco MASSEUBE Fra 450 Grm,102.75,Precio por 1 Kilo : $228.33
Alimentos Secos,Sabores Del Mundo,218918,Dulce Light Blueberry Arandano MASSEUBE Fra 260 Grm,75.85,Precio por 1 Kilo : $291.73
Alimentos Secos,Sabores Del Mundo,218917,Dulce Light Frutos Bosque MASSEUBE Fra 260 Grm,82.7,Precio por 1 Kilo : $318.07
Alimentos Secos,Sabores Del Mundo,218919,Dulce Light Mosqueta MASSEUBE Fra 260 Grm,75.29,Precio por 1 Kilo : $289.57
Alimentos Secos,Sabores Del Mundo,219389,Fideos  Nidi Nº 5 LA MOLISANA Est 500 Grm,117.69,Precio por 1 Kilo : $235.38
Alimentos Secos,Sabores Del Mundo,195074,Fideos Guiseros LA MOLISANA Fussilli Paq 500 Grm,102.75,Precio por 1 Kilo : $205.50
Alimentos Secos,Sabores Del Mundo,1406,Fideos Guiseros Sem. BARILLA Fusilli Cja 500 Grm,101.65,Precio por 1 Kilo : $203.30
Alimentos Secos,Sabores Del Mundo,1404,Fideos Guiseros Sem. BARILLA Penne Rigate Cja 500 Grm,101.65,Precio por 1 Kilo : $203.30
Alimentos Secos,Sabores Del Mundo,187579,Fideos Guiseros Sem. BARILLA Rigatoni Cja 500 Grm,101.65,Precio por 1 Kilo : $203.30
Alimentos Secos,Sabores Del Mundo,186547,Fideos Guiseros Sem. COLAVITA Penne Rigatti Paq 500 Grm,81.2,Precio por 1 Kilo : $162.40
Alimentos Secos,Leches En Polvo,254437,Leche En Polvo LA SERENISIMA Con Vit. B9 Est 500 Grm.,83.45,Precio por 1 Kilo : $166.90
Alimentos Secos,Leches En Polvo,260406,Leche En Polvo NAN Opti-Pro 1 Lat 900 Grm,342.39,Precio por 1 Kilo : $380.43
Alimentos Secos,Leches En Polvo,260407,Leche En Polvo NAN Opti-Pro 2 Lat 900 Grm,302.8,Precio por 1 Kilo : $336.44
Alimentos Secos,Leches En Polvo,260408,Leche En Polvo NAN Opti-Pro 3 Lat 800 Grm,194.99,Precio por 1 Kilo : $243.73
Alimentos Secos,Leches En Polvo,257084,Leche En Polvo NIDINA Formula Infantil Etapa 1 Lat 800 Grm,166.95,Precio por 1 Kilo : $208.68
Alimentos Secos,Leches En Polvo,257085,Leche En Polvo NIDINA Formula Infantil Etapa 2 Lat 800 Grm,149.79,Precio por 1 Kilo : $187.23
Alimentos Secos,Leches En Polvo,264540,Leche En Polvo NIDO Instantane Fortigrow Lat 800 Grm,113.45,Precio por 1 Kilo : $141.81
Alimentos Secos,Leches En Polvo,264541,Leche En Polvo NIDO Primera Infancia Lat 800 Grm.,96.99,Precio por 1 Kilo : $121.23
Alimentos Secos,Leches En Polvo,283786,Leche En Polvo NUTRILON Pro Futura 4 Lat 800 Grm,247.19,Precio por 1 Kilo : $308.98
Alimentos Secos,Leches En Polvo,269096,Leche En Polvo Pro Futura NUTRILON 1 Lat 800 Grm,363.79,Precio por 1 Kilo : $454.73
Alimentos Secos,Leches En Polvo,269097,Leche En Polvo Pro Futura NUTRILON 2 Lat 800 Grm,342.39,Precio por 1 Kilo : $427.98
Alimentos Secos,Leches En Polvo,269098,Leche En Polvo Pro Futura NUTRILON 3 Lat 800 Grm,252.85,Precio por 1 Kilo : $316.06
Alimentos Secos,Legumbres,110363,Lentejas RAMONEDA Bol 500 Grm,27.85,Precio por 1 Kilo : $55.70
Alimentos Secos,Legumbres,55874,Lentejon ADENOMAR Bol 400 Grm,21.39,Precio por 1 Kilo : $53.47
Alimentos Secos,Legumbres,129770,Lentejon ELIO Bol 400 Grm,37.45,Precio por 1 Kilo : $93.62
Alimentos Secos,Legumbres,78644,Lentejon LA EGIPCIANA Selección Superior Bol 400 Grm,31.05,Precio por 1 Kilo : $77.62
Alimentos Secos,Legumbres,7524,Lentejon RAMONEDA Bol 500 Grm,34.25,Precio por 1 Kilo : $68.50
Alimentos Secos,Legumbres,262127,Lentejones EGRAN Sin Remojo Bsa 400 Grm,48.15,Precio por 1 Kilo : $120.37
Alimentos Secos,Legumbres,78647,Maiz Blanco La Egipciana Paq 400 Grm,22.49,Precio por 1 Kilo : $56.22
Alimentos Secos,Legumbres,262108,Maiz EGRAN Pelado Blanco Bsa 500 Grm,24.6,Precio por 1 Kilo escurrido: $49.20
Alimentos Secos,Legumbres,27687,Maiz Pisado Blanco ELIO Bol 400 Grm,28.89,Precio por 1 Kilo : $72.22
Alimentos Secos,Legumbres,170566,Maiz Pisado Blanco LONQUIMAY Bol 400 Grm,21.39,Precio por 1 Kilo : $53.47
Alimentos Secos,Legumbres,213289,Maiz Pisado Blanco RAMONEDA Paq 500 Grm,22.47,Precio por 1 Kilo : $44.94
Alimentos Secos,Legumbres,27688,Maiz Pisado Colorado ELIO Bol 500 Grm,21.39,Precio por 1 Kilo : $42.78
Alimentos Secos,Encurtidos,243527,Aceitunas Verdes CASTELL Ahumado Fra 360 Grm,70.65,Precio por 1 Kilo escurrido: $321.13
Alimentos Secos,Encurtidos,124092,Aceitunas Verdes CASTELL Descarozadas Fra 200 Grm,43.89,Precio por 1 Kilo escurrido: $274.31
Alimentos Secos,Encurtidos,86458,Aceitunas Verdes CASTELL Descarozadas Pou 180 Grm,22.49,Precio por 1 Kilo escurrido: $281.12
Alimentos Secos,Encurtidos,100353,Aceitunas Verdes CASTELL Descarozadas Pou 300 Grm,35.3,Precio por 1 Kilo escurrido: $235.33
Alimentos Secos,Encurtidos,220073,Aceitunas Verdes CASTELL En Rodajas Doy 300 Grm,29.25,Precio por 1 Kilo escurrido: $195.00
Alimentos Secos,Encurtidos,86457,Aceitunas Verdes CASTELL En Rodajas Pou 180 Grm,20.25,Precio por 1 Kilo escurrido: $253.12
